I-Listitem	to the person class. Apart from this addition, the same	page=3 xpos=0 ypos=2 left-column left-indent aligned-line headchar-lower
I-Listitem	settings as in the previous experiment were used.	page=3 xpos=0 ypos=2 left-column centered left-indent right-indent aligned-line shorter-tail headchar-lower tailchar-period above-double-space above-line-space
B-Listitem	5: Leve The same settings as in the previous experiment,	page=3 xpos=0 ypos=2 left-column full-justified hanged-line longer-tail line-double-space line-space tailchar-comma
I-Listitem	but in addition generated versions of chunks of the	page=3 xpos=0 ypos=2 left-column left-indent indented-line headchar-lower
I-Listitem	text with a Levenshtein distance of one from what was	page=3 xpos=0 ypos=3 left-column left-indent aligned-line headchar-lower
I-Listitem	originally written were compared to the SNOMED CT	page=3 xpos=0 ypos=3 left-column left-indent aligned-line headchar-lower
I-Listitem	terms. This was carried out in order to find misspelled	page=3 xpos=0 ypos=3 left-column left-indent aligned-line headchar-lower
I-Listitem	SNOMED CT terms in the clinical text.	page=3 xpos=0 ypos=3 left-column left-indent right-indent aligned-line shorter-tail headchar-capital tailchar-period above-double-space above-line-space
B-Listitem	6: Perm The same preprocessing as in experiment	page=3 xpos=0 ypos=3 left-column full-justified hanged-line longer-tail line-double-space line-space
I-Listitem	4: Qual, but permutations of tokens in the clinical text	page=3 xpos=0 ypos=4 left-column left-indent indented-line
I-Listitem	were also generated and compared to the content of	page=3 xpos=0 ypos=4 left-column left-indent aligned-line headchar-lower
I-Listitem	SNOMED CT. Permutations were constructed for text	page=3 xpos=0 ypos=4 left-column left-indent aligned-line headchar-capital
I-Listitem	chunks containing a minimum of two tokens and a	page=3 xpos=0 ypos=4 left-column left-indent aligned-line headchar-lower
I-Listitem	maximum of five.	page=3 xpos=0 ypos=4 left-column left-indent right-indent aligned-line shorter-tail headchar-lower tailchar-period above-double-space above-line-space
B-Listitem	7: Comp The same preprocessing as in experiment	page=3 xpos=0 ypos=4 left-column full-justified hanged-line longer-tail line-double-space line-space
I-Listitem	4: Qual, but a compound splitter for Swedish was used	page=3 xpos=0 ypos=5 left-column left-indent indented-line
I-Listitem	(Sjöbergh and Kann, 2004) for all words that con-	page=3 xpos=0 ypos=5 left-column left-indent aligned-line year tailchar-hiphen
I-Listitem	tained at least ten letters. If a word was split into	page=3 xpos=0 ypos=5 left-column left-indent aligned-line headchar-lower
I-Listitem	smaller parts by the compound splitter, each of these	page=3 xpos=0 ypos=5 left-column left-indent aligned-line headchar-lower
I-Listitem	smaller parts was matched to the terminology and if	page=3 xpos=0 ypos=5 left-column left-indent aligned-line headchar-lower
I-Listitem	any of them matched a term in the terminology, it was	page=3 xpos=0 ypos=5 left-column left-indent aligned-line headchar-lower
I-Listitem	assigned the semantic class of that term. Versions of	page=3 xpos=0 ypos=5 left-column left-indent aligned-line headchar-lower
I-Listitem	the included parts of the word with a Levensthein dis-	page=3 xpos=0 ypos=6 left-column left-indent aligned-line headchar-lower tailchar-hiphen
I-Listitem	tance of one were also matched to the terminology.	page=3 xpos=0 ypos=6 left-column left-indent right-indent aligned-line shorter-tail headchar-lower tailchar-period above-double-space above-line-space
B-Listitem	8: ICD10 The same settings as in experiment 4: Qual, but	page=3 xpos=0 ypos=6 left-column full-justified hanged-line longer-tail line-double-space line-space
I-Listitem	ICD-10 codes (WHO, 2012) were also added as one	page=3 xpos=0 ypos=6 left-column left-indent indented-line year headchar-capital
I-Listitem	terminology to which the clinical text was matched.	page=3 xpos=0 ypos=6 left-column left-indent aligned-line headchar-lower tailchar-period
I-Listitem	For assigning the semantic class disorder, ICD-10	page=3 xpos=0 ypos=7 left-column left-indent aligned-line headchar-capital
I-Listitem	codes in chapter 1–17 and 19, except codes T357–	page=3 xpos=0 ypos=7 left-column left-indent aligned-line headchar-lower
I-Listitem	T629, were used. For assigning the semantic class	page=3 xpos=0 ypos=7 left-column left-indent aligned-line headchar-capital
I-Listitem	finding, codes in chapter 18 were used. No prepro-	page=3 xpos=0 ypos=7 left-column left-indent aligned-line headchar-lower tailchar-hiphen
I-Listitem	cessing of the ICD-10 code texts was carried out.	page=3 xpos=0 ypos=7 left-column left-indent right-indent aligned-line shorter-tail headchar-lower tailchar-period above-double-space above-line-space
B-Listitem	9: MeSH The same settings as in the previous experiment,	page=3 xpos=0 ypos=7 left-column full-justified hanged-line longer-tail line-double-space line-space tailchar-comma
I-Listitem	but terms from MeSH were also added. For assigning	page=3 xpos=0 ypos=8 left-column left-indent indented-line headchar-lower
I-Listitem	the semantic class disorder, terms in category F03 and	page=3 xpos=0 ypos=8 left-column left-indent aligned-line headchar-lower
I-Listitem	category C were used, except terms in category C23,	page=3 xpos=0 ypos=8 left-column left-indent aligned-line headchar-lower tailchar-comma
I-Listitem	which were used for assigning the semantic class find-	page=3 xpos=0 ypos=8 left-column left-indent aligned-line headchar-lower tailchar-hiphen
I-Listitem	ing. For assigning the semantic class body structure,	page=3 xpos=0 ypos=8 left-column left-indent aligned-line headchar-lower tailchar-comma
I-Listitem	terms in the MeSH categories A01–A10 were used.	page=3 xpos=0 ypos=8 left-column left-indent aligned-line headchar-lower tailchar-period
I-Listitem	The terms for body structure and disorder are often	page=3 xpos=0 ypos=8 left-column left-indent aligned-line headchar-capital
I-Listitem	expressed in plural in MeSH and were therefore lem-	page=3 xpos=0 ypos=9 left-column left-indent aligned-line headchar-lower tailchar-hiphen
I-Listitem	matised with Granska.	page=3 xpos=0 ypos=9 left-column left-indent right-indent aligned-line shorter-tail headchar-lower tailchar-period column-bottom
I-Listitem	10: Wiki The same settings as in the previous experiment,	page=3 xpos=5 ypos=0 right-column full-justified column-top tailchar-comma
I-Listitem	with the addition that terms in the Wikipedia list of	page=3 xpos=5 ypos=0 right-column left-indent indented-line headchar-lower
I-Listitem	diseases were used for assigning the semantic class	page=3 xpos=5 ypos=0 right-column left-indent aligned-line headchar-lower
I-Listitem	disorder.	page=3 xpos=5 ypos=0 right-column left-indent right-indent font-smaller aligned-line shorter-tail headchar-lower tailchar-period above-double-space above-line-space
B-Listitem	11: Abbr Three lists of abbreviations were generated;	page=3 xpos=5 ypos=0 right-column full-justified hanged-line longer-tail line-double-space line-space tailchar-semicolon
I-Listitem	abbreviations that matched the words in the other ter-	page=3 xpos=5 ypos=0 right-column left-indent indented-line headchar-lower tailchar-hiphen
I-Listitem	minologies for disorders, abbreviations that matched	page=3 xpos=5 ypos=1 right-column left-indent aligned-line headchar-lower
I-Listitem	findings and abbreviations that matched body struc-	page=3 xpos=5 ypos=1 right-column left-indent aligned-line headchar-lower tailchar-hiphen
I-Listitem	tures. The same settings as in the previous experiment	page=3 xpos=5 ypos=1 right-column left-indent aligned-line headchar-lower
I-Listitem	were used with the addition that these lists of abb-	page=3 xpos=5 ypos=1 right-column left-indent aligned-line headchar-lower tailchar-hiphen
I-Listitem	reviations were used for capturing abbreviated entities	page=3 xpos=5 ypos=1 right-column left-indent aligned-line headchar-lower
I-Listitem	and assigning the corresponding class.	page=3 xpos=5 ypos=1 right-column left-indent right-indent aligned-line shorter-tail headchar-lower tailchar-period above-double-space above-line-space
B-Body	For evaluation, the script from the CoNLL 2000 shared	page=3 xpos=5 ypos=2 right-column full-justified hanged-line longer-tail line-double-space line-space year headchar-capital
I-Body	task <sup>2</sup> was applied. This script calculates precision and re-	page=3 xpos=5 ypos=2 right-column full-justified font-largest aligned-line headchar-lower tailchar-hiphen
I-Body	call as well as F-score for exact match, and to this a calcu-	page=3 xpos=5 ypos=2 right-column full-justified aligned-line headchar-lower tailchar-hiphen
I-Body	lation of a 95% confidence interval for precision and recall	page=3 xpos=5 ypos=2 right-column full-justified aligned-line headchar-lower
E-Body	was added.	page=3 xpos=5 ypos=2 right-column right-indent aligned-line shorter-tail headchar-lower tailchar-period
B-Body	An error analysis, mainly focusing on occurrences of abb-	page=3 xpos=5 ypos=2 right-column full-justified aligned-line longer-tail headchar-capital tailchar-hiphen
I-Body	reviations and number of tokens in annotated instances, was	page=3 xpos=5 ypos=3 right-column full-justified aligned-line headchar-lower
I-Body	carried out, since it was hypothesised that those features	page=3 xpos=5 ypos=3 right-column full-justified aligned-line headchar-lower
E-Body	would affect the result.	page=3 xpos=5 ypos=3 right-column right-indent aligned-line shorter-tail headchar-lower tailchar-period above-double-space above-line-space
B-SectionHeader	4. Results	page=3 xpos=6 ypos=3 right-column centered left-indent right-indent font-largest indented-line longer-tail line-double-space line-space itemization above-line-space
B-SubsectionHeader	4.1. Properties of the annotated entities	page=3 xpos=5 ypos=3 right-column right-indent hanged-line longer-tail line-space above-line-space
B-Body	In the evaluation data, which contained 26,011 tokens, a	page=3 xpos=5 ypos=4 right-column full-justified aligned-line longer-tail line-space headchar-capital
I-Body	total of 2,342 annotations had been made. The number of	page=3 xpos=5 ypos=4 right-column full-justified aligned-line headchar-lower
E-Body	annotation instances for each class is shown in Table 1.	page=3 xpos=5 ypos=4 right-column right-indent aligned-line shorter-tail headchar-lower tailchar-period above-double-space above-line-space
Table	__Table 1__	page=3 xpos=5 ypos=4 right-column centered left-indent right-indent box indented-line shorter-tail line-double-space line-space table-area above-blank-line above-double-space above-line-space
B-Caption	Table 1: Total number of instances that were used for the	page=3 xpos=5 ypos=5 right-column full-justified hanged-line longer-tail line-blank-line line-double-space line-space string-table headchar-capital
E-Caption	evaluation.	page=3 xpos=5 ypos=5 right-column right-indent aligned-line shorter-tail headchar-lower tailchar-period above-blank-line above-double-space above-line-space
B-SubsectionHeader	4.2. Automatic recognition of the annotated entities	page=3 xpos=5 ypos=6 right-column right-indent aligned-line longer-tail line-blank-line line-double-space line-space above-line-space
B-Body	The results for each one of the eleven preprocessing exper-	page=3 xpos=5 ypos=6 right-column full-justified aligned-line longer-tail line-space headchar-capital tailchar-hiphen
I-Body	iments are shown in Tables 2, 3 and 4. Even though the	page=3 xpos=5 ypos=6 right-column full-justified aligned-line headchar-lower
I-Body	results for each entity type are presented in a separate table,	page=3 xpos=5 ypos=6 right-column full-justified aligned-line headchar-lower tailchar-comma
I-Body	the system always attempted to recognise all three types of	page=3 xpos=5 ypos=6 right-column full-justified aligned-line headchar-lower
I-Body	entities, which means that the results for one entity might	page=3 xpos=5 ypos=6 right-column full-justified aligned-line headchar-lower
I-Body	affect the results for another. This is a more realistic usage	page=3 xpos=5 ypos=7 right-column full-justified aligned-line headchar-lower
I-Body	of the system than to try to recognise each semantic class	page=3 xpos=5 ypos=7 right-column full-justified aligned-line headchar-lower
E-Body	separately.	page=3 xpos=5 ypos=7 right-column right-indent aligned-line shorter-tail headchar-lower tailchar-period
B-Body	The results above the horizontal line in Tables 2–4 show	page=3 xpos=5 ypos=7 right-column full-justified aligned-line longer-tail headchar-capital
I-Body	experiments using only the SNOMED CT terminology,	page=3 xpos=5 ypos=7 right-column full-justified aligned-line headchar-lower tailchar-comma
I-Body	whereas the experiments presented under the horizontal	page=3 xpos=5 ypos=7 right-column full-justified aligned-line headchar-lower
E-Body	line show results with additional terminologies.	page=3 xpos=5 ypos=8 right-column right-indent aligned-line shorter-tail headchar-lower tailchar-period
B-Body	The baseline results for body structure show exceptionally	page=3 xpos=5 ypos=8 right-column full-justified aligned-line longer-tail headchar-capital
I-Body	low recall, since terms for body structures are not indepen-	page=3 xpos=5 ypos=8 right-column full-justified aligned-line headchar-lower tailchar-hiphen
I-Body	dent SNOMED CT terms, but are included in descriptive	page=3 xpos=5 ypos=8 right-column full-justified aligned-line headchar-lower
I-Body	expressions (e.g. arm as structure or arm as a whole).	page=3 xpos=5 ypos=8 right-column full-justified aligned-line headchar-lower tailchar-period
I-Body	Stop word filtering was therefore added to SNOMED CT	page=3 xpos=5 ypos=8 right-column full-justified aligned-line headchar-capital
I-Body	terms describing body structure, which improved the recall.	page=3 xpos=5 ypos=8 right-column full-justified aligned-line headchar-lower tailchar-period above-double-space above-line-space
B-Footnote	<sup>2</sup> http://www.cnts.ua.ac.be/conll2000/chunking/	page=3 xpos=5 ypos=9 right-column left-indent right-indent font-largest indented-line shorter-tail line-double-space line-space year headchar-super column-bottom above-blank-line above-double-space above-line-space
Page	1253	page=3 xpos=4 ypos=9 single-column left-indent right-indent font-largest column-top line-blank-line line-double-space line-space numeric-only page-bottom
B-Body	Only results from stop word filtering of the SNOMED CT	page=4 xpos=0 ypos=0 left-column full-justified page-top headchar-capital
I-Body	terms for body structure are presented here, since the same	page=4 xpos=0 ypos=0 left-column full-justified aligned-line headchar-lower
I-Body	technique applied to disorder and finding resulted in a de-	page=4 xpos=0 ypos=0 left-column full-justified aligned-line headchar-lower tailchar-hiphen
E-Body	creased precision without an improvement of recall.	page=4 xpos=0 ypos=0 left-column right-indent aligned-line shorter-tail headchar-lower tailchar-period
B-Body	A number of minimum lengths of words for which to gen-	page=4 xpos=0 ypos=0 left-column full-justified aligned-line longer-tail headchar-capital tailchar-hiphen
I-Body	erate Levenshtein distance versions were tested. Only the	page=4 xpos=0 ypos=0 left-column full-justified aligned-line headchar-lower
I-Body	best results are presented here, which were obtained for a	page=4 xpos=0 ypos=0 left-column full-justified aligned-line headchar-lower
E-Body	minimum length of 8 letters.	page=4 xpos=0 ypos=1 left-column right-indent aligned-line shorter-tail headchar-lower tailchar-period above-double-space above-line-space
Table	__Table 2__	page=4 xpos=-1 ypos=1 left-column left-over right-over box longer-tail line-double-space line-space table-area above-double-space above-line-space
B-Caption	Table 2: Results for the semantic class disorder. Prepro-	page=4 xpos=0 ypos=3 left-column full-justified shorter-tail line-double-space line-space string-table headchar-capital tailchar-hiphen
I-Caption	cessing had no or little effect, but the inclusion of additional	page=4 xpos=0 ypos=3 left-column full-justified aligned-line headchar-lower
E-Caption	terminologies (8:ICD10 – 11:Abbr) improved recall.	page=4 xpos=0 ypos=3 left-column right-indent aligned-line shorter-tail headchar-lower tailchar-period above-double-space above-line-space
Table	__Table 3__	page=4 xpos=-1 ypos=4 left-column left-over right-over box longer-tail line-double-space line-space table-area above-double-space above-line-space
B-Caption	Table 3: Results for the semantic class finding. Lemmatisa-	page=4 xpos=0 ypos=6 left-column full-justified shorter-tail line-double-space line-space string-table headchar-capital tailchar-hiphen
I-Caption	tion (2:Lemm) and compound splitting (3:Comp) improved	page=4 xpos=0 ypos=6 left-column full-justified aligned-line headchar-lower
I-Caption	recall, whereas an inclusion of a match to SNOMED CT	page=4 xpos=0 ypos=6 left-column full-justified aligned-line headchar-lower
I-Caption	terms for qualifiers and persons (4:Qual) slightly improved	page=4 xpos=0 ypos=7 left-column full-justified aligned-line headchar-lower
E-Caption	precision.	page=4 xpos=0 ypos=7 left-column right-indent aligned-line shorter-tail headchar-lower tailchar-period above-blank-line above-double-space above-line-space
B-SubsectionHeader	4.3. Error analysis	page=4 xpos=0 ypos=7 left-column right-indent aligned-line longer-tail line-blank-line line-double-space line-space above-line-space
B-Body	An error analysis of the false positives and false negatives	page=4 xpos=0 ypos=7 left-column full-justified aligned-line longer-tail line-space headchar-capital
I-Body	was carried out for the experiment 4: Qual. False posi-	page=4 xpos=0 ypos=8 left-column full-justified aligned-line headchar-lower tailchar-hiphen
I-Body	tives are tokens that the system incorrectly assigned one of	page=4 xpos=0 ypos=8 left-column full-justified aligned-line headchar-lower
I-Body	the three classes disorder, finding and body structure. False	page=4 xpos=0 ypos=8 left-column full-justified aligned-line headchar-lower
I-Body	negatives are tokens that were assigned one of the three se-	page=4 xpos=0 ypos=8 left-column full-justified aligned-line headchar-lower tailchar-hiphen
I-Body	mantic classes by the annotator but that were not assigned	page=4 xpos=0 ypos=8 left-column full-justified aligned-line headchar-lower
I-Body	a semantic class by the system, thus the instances that the	page=4 xpos=0 ypos=8 left-column full-justified aligned-line itemization headchar-lower
E-Body	system failed to match.	page=4 xpos=0 ypos=8 left-column right-indent aligned-line shorter-tail headchar-lower tailchar-period
B-Body	The average number of tokens that were annotated for ex-	page=4 xpos=0 ypos=9 left-column full-justified aligned-line longer-tail headchar-capital tailchar-hiphen
I-Body	pressions of clinical entities varied between the different	page=4 xpos=0 ypos=9 left-column full-justified aligned-line headchar-lower column-bottom
Table	__Table 4__	page=4 xpos=5 ypos=-1 right-column left-over right-over box column-top table-area above-double-space above-line-space
B-Caption	Table 4: Results for the semantic class body structure.	page=4 xpos=5 ypos=1 right-column full-justified shorter-tail line-double-space line-space string-table headchar-capital tailchar-period
I-Caption	Stop word filtering (3:Stop) improved recall considerably,	page=4 xpos=5 ypos=2 right-column full-justified aligned-line headchar-capital tailchar-comma
I-Caption	whereas an inclusion of a match to SNOMED CT terms for	page=4 xpos=5 ypos=2 right-column full-justified aligned-line headchar-lower
I-Caption	qualifiers and persons (4:Qual) improved precision. The	page=4 xpos=5 ypos=2 right-column full-justified aligned-line headchar-lower
E-Caption	best F-score was obtained for 11:Abbr.	page=4 xpos=5 ypos=2 right-column right-indent aligned-line shorter-tail headchar-lower tailchar-period above-blank-line above-double-space above-line-space
I-Body	semantic classes, as shown in Table 5. Body structures	page=4 xpos=5 ypos=2 right-column full-justified aligned-line longer-tail line-blank-line line-double-space line-space headchar-lower
I-Body	were almost exclusively annotated as one-token expres-	page=4 xpos=5 ypos=3 right-column full-justified aligned-line headchar-lower tailchar-hiphen
I-Body	sions, whereas disorders were annotated as two-token ex-	page=4 xpos=5 ypos=3 right-column full-justified aligned-line headchar-lower tailchar-hiphen
I-Body	pressions in many cases. For findings, two-token as well	page=4 xpos=5 ypos=3 right-column full-justified aligned-line headchar-lower
I-Body	as three-token expressions were common, and expressions	page=4 xpos=5 ypos=3 right-column full-justified aligned-line headchar-lower
I-Body	containing up to 13 tokens existed. The distributions of the	page=4 xpos=5 ypos=3 right-column full-justified aligned-line headchar-lower
I-Body	number of annotated tokens for disorders and findings, di-	page=4 xpos=5 ypos=3 right-column full-justified aligned-line headchar-lower tailchar-hiphen
I-Body	vided into false negatives and true positives, are shown in	page=4 xpos=5 ypos=4 right-column full-justified aligned-line headchar-lower
I-Body	Figures 1 and 2. No entities containing more than two to-	page=4 xpos=5 ypos=4 right-column full-justified aligned-line string-figure headchar-capital tailchar-hiphen
E-Body	kens were recognised by the constructed system.	page=4 xpos=5 ypos=4 right-column right-indent aligned-line shorter-tail headchar-lower tailchar-period above-double-space above-line-space
B-Body	__Figure 1__	page=4 xpos=5 ypos=4 right-column full-justified box aligned-line longer-tail line-double-space line-space figure-area above-double-space above-line-space
B-Caption	Figure 1: Distribution of the number of tokens for anno-	page=4 xpos=5 ypos=7 right-column full-justified aligned-line line-double-space line-space string-figure headchar-capital tailchar-hiphen
I-Caption	tated disorders, divided into true positives and false neg-	page=4 xpos=5 ypos=7 right-column full-justified aligned-line headchar-lower tailchar-hiphen
I-Caption	atives (for 4:Qual). No disorders longer than two tokens	page=4 xpos=5 ypos=7 right-column full-justified aligned-line headchar-lower
E-Caption	were recognised by the constructed rule-based system.	page=4 xpos=5 ypos=7 right-column right-indent aligned-line shorter-tail headchar-lower tailchar-period above-blank-line above-double-space above-line-space
B-Body	It could also be concluded from the error analysis that some	page=4 xpos=5 ypos=8 right-column full-justified aligned-line longer-tail line-blank-line line-double-space line-space headchar-capital
I-Body	findings were expressed in a combinations of two or more	page=4 xpos=5 ypos=8 right-column full-justified aligned-line headchar-lower
I-Body	separate findings (e.g. ECG and urine sample both OK).	page=4 xpos=5 ypos=8 right-column full-justified aligned-line headchar-lower tailchar-period
I-Body	Since the annotation scheme did not allow nested anno-	page=4 xpos=5 ypos=8 right-column full-justified aligned-line headchar-capital tailchar-hiphen
I-Body	tations, combined findings were annotated as one entity,	page=4 xpos=5 ypos=8 right-column full-justified aligned-line headchar-lower tailchar-comma
I-Body	which resulted in annotated entities that were not likely to	page=4 xpos=5 ypos=8 right-column full-justified aligned-line headchar-lower
E-Body	be present in the terminology.	page=4 xpos=5 ypos=8 right-column right-indent aligned-line shorter-tail headchar-lower tailchar-period
B-Body	The number of false negatives that contained abbreviations	page=4 xpos=5 ypos=9 right-column full-justified aligned-line longer-tail headchar-capital
I-Body	and the number of correctly matched instances that con-	page=4 xpos=5 ypos=9 right-column full-justified aligned-line headchar-lower tailchar-hiphen column-bottom above-blank-line above-double-space above-line-space
Page	1254	page=4 xpos=4 ypos=9 single-column left-indent right-indent font-largest column-top line-blank-line line-double-space line-space numeric-only page-bottom
Figure	__Figure 2__	page=5 xpos=-1 ypos=-1 left-column centered left-over right-over box page-top figure-area above-double-space above-line-space
B-Caption	Figure 2: Distribution of the number of tokens for anno-	page=5 xpos=0 ypos=2 left-column full-justified line-double-space line-space string-figure headchar-capital tailchar-hiphen
I-Caption	tated findings, divided into true positives and false nega-	page=5 xpos=0 ypos=2 left-column full-justified aligned-line headchar-lower tailchar-hiphen
I-Caption	tives (for 4:Qual). No findings longer than two tokens were	page=5 xpos=0 ypos=3 left-column full-justified aligned-line headchar-lower
E-Caption	recognised by the constructed rule-based system.	page=5 xpos=0 ypos=3 left-column right-indent aligned-line shorter-tail headchar-lower tailchar-period above-blank-line above-double-space above-line-space
I-Body	tained abbreviations are shown in Table 5. As can be seen	page=5 xpos=0 ypos=3 left-column full-justified aligned-line longer-tail line-blank-line line-double-space line-space headchar-lower
I-Body	in the table, almost no correctly matched instances con-	page=5 xpos=0 ypos=3 left-column full-justified aligned-line headchar-lower tailchar-hiphen
I-Body	tained abbreviations, and abbreviations were more common	page=5 xpos=0 ypos=4 left-column full-justified aligned-line headchar-lower
I-Body	among false negatives than in general. In experiment 11:	page=5 xpos=0 ypos=4 left-column full-justified aligned-line headchar-lower tailchar-colon
I-Body	Abbr, the abbreviation list matched two types of disorders	page=5 xpos=0 ypos=4 left-column full-justified aligned-line headchar-capital
